location,date,source,headline,crime_type,article,age,businessman,url,percentile
Burari,2019-09-16	2019-10-15	2019-12-12	2020-02-16,Hindustan Times	Business Standard	Times of India	Business Standard,"Gogi: Killer who returned a year after 4 murders	Two involved in over dozen cases of robbery in UP, Delhi nabbed after shootout	Accused warns rape survivor of fate worse than Unnao victim’s | India News - Times of India	Man arrested for burglary in southeast Delhi",murder	robbery	rape	burglary,"Fifteen months after he shot dead three rival gangsters on a busy road in north Delhi’s Burari, Jitender Gogi — one of Delhi’s most wanted gangsters — has allegedly been named in the daring shootout in Narela on September 8 in which Virender Mann, a history sheeter, was killed. Police claimed that witnesses has identified one of the shooters as Jitender Gogi. Along with two aides, Gogi allegedly intercepted Mann’s car and pumped in 20 bullets in his body. Police said Gogi was last seenin Burari shootout in which a passeby woman was also killed. He had been on the run. With at least a dozen cases, including murder and extortion, Gogi carries a reward of Rs 4 lakh on his arrest. He was last arrested in 2016, but had fled police custody within three months. Police have also registered a case under the stringent MCOCA (Maharashtra Control of Organised Crime Act) Act against him. Police officers who are trying to hunt Gogi down said he does not use one phone for long and changes his hideouts almost every other day. Police have in the past traced his location to Nepal and the other neighbouring states in north India. A police officer, who did not wish to be named, said booking Gogi under MCOCA means that on his arrest, he will not be bailed out easily and other criminals or associates sheltering him will also be booked. Further, the stringent law allows police to attach his properties acquired through illegal means, further weakening the activities of his gang, the officer said requesting anonymity.Gogi’s involvements have surfaced in crimes such as murders, attempts to murder, extortion, possession of illegal arms, carjacking and land grabbing.Investigation in several cases against the gangster shows that it was Gogi, his right hand Kuldeep Fajja and their gang member Rohit Moi who were involved in September 8 shoot out in which Virender Mann was killed. The trio’s name also surfaced in Burari shootings last year .Gogi was not always the most feared gangster. He was once a bright student at Delhi university. It was while studying in Swami Shraddhanand College that Gogi developed enmity with another student, Sunil alias Tillu, whose associates had allegedly beaten Gogi’s friend who was contesting college elections. The rival candidate was Tillu’s cousin. Gogi’s friend then withdrew his name and Tillu’s cousin won the elections.This incident gave birth to an alleged rivalry between Gogi and Tillu that has claimed more than 10 lives from both the groups over the past decade. While Gogi, last arrested in 2016 managed to flee from police custody, Tillu is currently in jail.	Two men involved in over a dozen cases of robbery and snatching have been nabbed by the Special Cell of Delhi Police following a shootout at Wazirabad Burari road on Tuesday night, police said.

Police uniforms, two pistols and a motorcycle were seized from them.

The incident took place at around 10.15 pm when a police team stationed on Wazirabad-Burari road near Jagatpur flyover spotted a motorcycle coming from Wazirabad side and signalled it to stop but the bike-borne miscreants opened fire on police team, they said.

The duo fired four rounds, forcing police to retaliate resulting in one of the accused, later identified as Ravi (26) suffering bullet injury in his leg, they said.

The second accomplice, Mustakin (51) was apprehended unhurt, the police said.

The injured was admitted to a nearby hospital, a senior police official said.	MEERUT: A day before an 18-year-old rape survivor was to testify in a court in Delhi’s Rohini area, her family in Baghpat ’s Bijrol village found a note pasted outside their house, threatening them that the girl will face a fate worse than the Unnao victim’s if she appeared before the court.“If she testifies in court on December 13, consequences will not be good. They may be worse than what happened in Unnao,” the note read.Even during an earlier court hearing, the accused had harassed the survivor so much that she had to be admitted to a Delhi hospital and could not make it to the court, her father said.Acting swiftly, the local police filed an FIR and arrested the accused on Thursday.Baghpat superintendent of police Gopendra Yadav said, “We arrested Soran Singh , 30, during the early hours of Thursday on the basis of the complaint made by the survivor’s father. He has been charged with criminal intimidation.”According to police, the survivor used to stay with her father, a taxi driver, in Delhi’s Burari area for coaching in 2018 when she came in contact with Singh, who belonged to her village in Baghpat.In July 2018, Singh took her to a vacant flat in Mukherjee Nagar on the pretext of providing her with notes for her studies, spiked her drink and allegedly raped her. He also filmed the act and began to blackmail her into submission. Unable to continue with repeated sexual abuse, she filed a police complaint in Delhi.Singh was booked under IPC sections 376 (rape) and 328 (causing hurt by means of poison with an intent to commit offence). According to the FIR and chargesheet, Soran was arrested on July 11, 2018 but was released on bail on July 30 the same year. Ever since, Soran had been pressuring the family for a compromise.“My daughter is terrified as the accused continues to haunt our family. He has accosted me many a time and even threatened my daughter when she had gone to appear in her exams in a local college. He hounded my daughter so badly the last time that she had to be admitted to Delhi’s St. Stephens Hospital because of trauma and could not make it to the court hearing,” the survivor’s father said.	A 22-year-old man was arrested for allegedly committing burglary at a house in southeast Delhi's Lajpat Nagar, police said on Sunday.

The accused, Manoj Singh, is a native of Uttarakhand's Champawat district and was living in a rented house in north Delhi's Burari. He was arrested on Friday, they said.

On February 4, police received a complaint from one Agender Kumar about a burglary at his house. The lock on the main door of his house had been broken to gain entry, the police said.

Singh was seen in the footage of a CCTV camera installed near Kumar's house. He was seen carrying a black bag and was later identified through face recognition app, they said.

On the basis of technical surveillance, the police raided Singh's residence in Champawat's Kaknai village and arrested him, Deputy Commissioner of Police (Southeast) R P Meena said.

Stolen jewellery and cash worth approximately Rs 25 lakh was recovered from him, he said.

During interrogation, Singh told police he wanted to have a lavish lifestyle and was fond of premium whiskey. He often used to visit bars and cafes in Hauz Khas village and Paharganj, he added.

Singh was unemployed and committed burglaries to earn easy money. He has spent thousands of rupees of the stolen money in bars, Meena said.

He looked for houses in colonies and residential societies which would be locked in the day. He stole cash and jewellery but never things like mobile phones and laptops, fearing they could be traced, he said.

He was previously involved in five cases of burglaries, the DCP said.",-1	-1	18	22,0	0	0	1,https://www.hindustantimes.com/delhi-news/gogi-killer-who-returned-a-year-after-4-murders/story-P0anBo8ecjBXY6J1rkUtnN.html	https://www.business-standard.com/article/pti-stories/two-involved-in-over-dozen-cases-of-robbery-in-up-delhi-nabbed-after-shootout-119101600025_1.html	https://timesofindia.indiatimes.com/india/accused-warns-rape-survivor-of-fate-worse-than-unnao-victims/articleshow/72499214.cms	https://www.business-standard.com/article/pti-stories/man-arrested-for-burglary-in-southeast-delhi-120021600665_1.html,77
