location,date,source,headline,crime_type,article,age,businessman,url,percentile
Inderpuri,2019-10-14,Business Standard,Man held for burglary in Patel Nagar,burglary,"A 19-year-old man was arrested for allegedly burgling houses where he worked as a domestic help in Central Delhi's Patel Nagar, police said on Monday.

Vinod Kumar Arya, a resident of Dashghara village in Inderpuri, was arrested after one of the house owners complained to police on October 3 about burglary at her home.

The owner said gold ornaments, wrist-watches, mobile phone and Rs 40,000 were looted from the house when her family members were sleeping, police said.

The footage from a CCTV camera installed at the house showed a person committing the burglary and he was arrested Saturday morning from Dashghara village, said Mandeep Singh Randhawa, deputy commissioner of police (Central Delhi).

Interrogation revealed that the accused had committed several incidents of house theft and burglary in Patel Nagar. He used seek employment as a servant and left it after committing theft, the DCP said.

Gold ornaments, one wrist watch, one mobile phone and a camera has been recovered from him.",19,0,https://www.business-standard.com/article/pti-stories/man-held-for-burglary-in-patel-nagar-119101401341_1.html,95
Tilak nagar,2019-10-14	2020-02-12	2020-02-12,Times of India	Times of India	Business Standard,Bengaluru: 14-year-old rape survivor explains horror in detail to nail rapist | Bengaluru News - Times of India	Delhi Robbery: Masked man robs Rs 1.5 lakh from west Delhi bank | Delhi News - Times of India	UP: Man who shot dead rape victim's father in Firozabad arrested,rape	robbery	rape,"BENGALURU: A 14-year-old girl, who was brutally raped when she was eight, got justice after she held her nerve and explained in court the details of the horrifying incident. The perpetrator was last week sentenced to life imprisonment.The convicted is 25-year-old Mallikarujna, a resident of Gulbarga colony in Tilak Nagar in the city. On December 28, 2013, Mallikarujna kidnapped and raped the girl, who was heading back home after buying sambar powder in the locality. Tilaknagar police , who had registered a case, arrested Mallikarjuna. Consistency in the girl’s statements and medical reports were strong evidence in the case, the trial for which lasted six years.Additional city civil and sessions special judge SH Pushpanjali Devi, who took cognisance of the survivor’s complete statement and intensely scrutinised the arguments during cross-examination, said there was no room to show mercy towards the accused, who committed such a heinous act.The girl, who was aged nine years when she appeared in court, answered the questions without fear or confusion. She narrated how Mallikarjuna gagged her and took her towards a deserted house and then assaulted her. Apart from explaining the horror in detail, she also identified the accused.Mallikarjuna, however, maintained he hadn’t committed any offence and prayed the court be lenient with him. The judge, however, termed it an ‘inhuman and brutal act’ on the survivor, who was made to suffer. “This cannot be equated in terms of money or other valuables. Nowadays, these type of devilish acts of rape and sexual assaults are repeatedly happening in society, particularly on children. The accused in this case cannot be shown any mercy as he has committed a heinous offence,” she said. The court also ordered a compensation of Rs 3 lakh for the survivor under Pocso Act , 2012.	NEW DELHI: A masked man robbed Rs 1.5 lakh at gunpoint from a public sector bank in west Delhi's Tilak Nagar on Wednesday morning, police said.When the bank opened for regular business, the masked man, wearing a black jacket, blue trousers and a blue cap, entered it at 10.20 am and overpowered the security guard, they said.He pointed a gun and demanded money from a bank staffer, who gave him Rs 1.5 lakh from the cash counter, a police officer said. The robber fled from the spot on a scooter.Multiple teams have launched a manhunt to find the robber, he added.	A man accused of killing the father of a rape victim here has been arrested, police said on late Wednesday night.

Superintendent of Police (city) Prabal Pratap Singh on Wednesday said, ""Achaman Upadhaya, who was accused of killing the father of a rape victim has been arrested following an encounter. The police had announced a cash reward of Rs 50,000 on the accused."" 



At the time of the encounter, Upadhaya was accompanied by two of his associates, one of whom was arrested while the other managed to escape, police said, adding that a police jawan too sustained bullet injury.

The 50-year-old father of the rape victim was shot dead on late Monday night in New Tilak Nagar area of Firozabad. The family alleged that the accused in the rape case was responsible for the killing.

Following the incident, three policemen were suspended for laxity, the SSP said.

The victim's daughter was raped six months ago and a man identified as Achaman Upadhaya was made the accused in the case, SSP Sachin Patel had said on Tuesday.",14	-1	50,0	0	0,https://timesofindia.indiatimes.com/city/bengaluru/bengaluru-14-year-old-rape-survivor-explains-horror-in-detail-to-nail-rapist/articleshow/71585082.cms	https://timesofindia.indiatimes.com/city/delhi/masked-man-robs-rs-1-5-lakh-from-west-delhi-bank/articleshow/74096836.cms	https://www.business-standard.com/article/pti-stories/up-man-who-shot-dead-rape-victim-s-father-in-firozabad-arrested-120021300069_1.html,83
Nangloi,2019-10-14,Business Standard,"Two arrested, two apprehended over killing of their robbery gang 'leader'",robbery,"Two men were arrested and two juveniles apprehended for allegedly killing their suspected gang leader after a scuffle over who would get the larger share from money robbed from pedestrians near railway tracks, police said on Monday.

The accused have been identified as Ankit (22), a resident of Bakkarwala Village, and Gautam (22), a resident of Mundka Village and two juveniles were apprehended, they said.

According to police, the body of a man with multiple stab injuries was recovered on Thursday at 5.36 am, around 100 metre away from railway crossing number 14, Hind Vihar, Delhi, police said.

The victim was later identified as Gaurav, a resident of Mundka Village, they said.

""During investigation, police arrested Ankit from Mundka Railway Station and a Knife was recovered from his possession. On his instance, Gautam and two juveniles were also apprehended,"" said Dinesh Kumar Gupta, Deputy Commissioner of Police (Southeast).

Interrogation revealed that the victim and the four accused persons belonged to a gang led by Gaurav.

They used to assemble at Mundka Railway Station at night and proceed to other stations along the railway line to rob the pedestrians near the tracks, the DCP said.

On Wednesday around 10 pm, they assembled at Mundka railway station and after 12, they proceeded on the railway track towards Nangloi side, they said.

When they were about to reach Hind Vihar railway crossing, Gaurav started abusing and shouting that he is the leader of the gang and his share amount should be at least double of that of other members, following which they objected, he said.

Gaurav took out his knife and pointed towards them. In the meantime, he hit Ankit. In retaliation, the other four overpowered him and stabbed him, the DCP added.",-1,0,https://www.business-standard.com/article/pti-stories/two-arrested-two-apprehended-over-killing-of-their-robbery-gang-leader-119101401396_1.html,95
Mundka,2019-10-14,Business Standard,"Two arrested, two apprehended over killing of their robbery gang 'leader'",robbery,"Two men were arrested and two juveniles apprehended for allegedly killing their suspected gang leader after a scuffle over who would get the larger share from money robbed from pedestrians near railway tracks, police said on Monday.

The accused have been identified as Ankit (22), a resident of Bakkarwala Village, and Gautam (22), a resident of Mundka Village and two juveniles were apprehended, they said.

According to police, the body of a man with multiple stab injuries was recovered on Thursday at 5.36 am, around 100 metre away from railway crossing number 14, Hind Vihar, Delhi, police said.

The victim was later identified as Gaurav, a resident of Mundka Village, they said.

""During investigation, police arrested Ankit from Mundka Railway Station and a Knife was recovered from his possession. On his instance, Gautam and two juveniles were also apprehended,"" said Dinesh Kumar Gupta, Deputy Commissioner of Police (Southeast).

Interrogation revealed that the victim and the four accused persons belonged to a gang led by Gaurav.

They used to assemble at Mundka Railway Station at night and proceed to other stations along the railway line to rob the pedestrians near the tracks, the DCP said.

On Wednesday around 10 pm, they assembled at Mundka railway station and after 12, they proceeded on the railway track towards Nangloi side, they said.

When they were about to reach Hind Vihar railway crossing, Gaurav started abusing and shouting that he is the leader of the gang and his share amount should be at least double of that of other members, following which they objected, he said.

Gaurav took out his knife and pointed towards them. In the meantime, he hit Ankit. In retaliation, the other four overpowered him and stabbed him, the DCP added.",-1,0,https://www.business-standard.com/article/pti-stories/two-arrested-two-apprehended-over-killing-of-their-robbery-gang-leader-119101401396_1.html,95
Mangolpuri,2019-10-14	2019-11-13,Business Standard	Times of India,New Delhi: Crime Branch arrests three men for plotting murder	Arrest of snatchers solves Rohini murder case | Delhi News - Times of India,murder	murder,"The Anti Human Trafficking Unit (AHTU) of Crime Branch, Delhi, has arrested three men who were planning to commit a murder, and recovered three pistols from their possession.

The criminals have been identified as Rahul (23), Govinder (23) and Sunil (23).

BK Singh, Additional Commissioner of Police, Crime Branch Delhi, in a statement said, ""On October 10, we received information from the Crime Branch that Rahul and his associates would be coming to Mangolpuri. A team of AHTU was constituted to conduct the raid. A trap was laid and Rahul, Govinder and Sunil were apprehended from DSIDC Complex. Three sophisticated 7.65 mm pistols with 15 rounds were recovered.""

""During the interrogation, it was found that all three accused persons are bootleggers and have several cases of bootlegging registered against them,"" he added.

According to the police, a person named Satish Bhadani from Haryana and his associates Johnny and Sunny had been trying to extort money from the accused persons.

Rahul had therefore recently procured three pistols for himself and his companions and was planning to take revenge and murder Satish.

All three accused have been arrested for possession of illegal firearms. Further investigation regarding the source of weapons and their bootlegging racket is underway.	NEW DELHI: The arrest of four people, including two mobile snatchers, on Tuesday solved the murder of a transporter’s employee in Rohini last week. The employee was found dead with stab wounds near Madhuban Chowk. 

After a police investigation, it was found the men who had snatched the phone had sold it to a receiver of stolen goods. The mastermind is said to be a juvenile, who was also nabbed on Monday. 

The murder came to light last Tuesday when cops at the Mangolpuri police station were informed about an unidentified body lying in the bushes. When cops reached the scene, they found a man with stab wounds on his chest and abdomen. Later, the victim was identified as Sudhir Dabas, a resident of Mangolpur Kalan village. 

 

The police probe also revealed that Sudhir, who worked for a transporter, was on his way back from work when he was killed. The family members reported that his mobile was missing from his personal belongings. 

“A police team formed to track down the killers found that his mobile phone was switched on by someone nearby. The person was tracked down and arrested,” said DCP (outer Delhi) A Koan. On being questioned, Raja Prasad said he had bought the phone from one Arpit. Based on his inputs, Arpit, too, was arrested from Mangolpuri. During his interrogation, Arpit admitted that he was aware of the phone belonging to a murder victim. He revealed that a juvenile and his friend, identified as Harish, had sold the mobile to him. The duo were tracked down and caught near Madhuban Chowk. While Harish was taken into custody, the juvenile was sent to a reforms home. 

When questioned, Harish told cops that he and the juvenile were consuming drugs near Madhuban Chowk when they saw the victim. They followed him until they reached a secluded spot where they held him at knifepoint and asked him to hand over his belongings. When he tried to resist, the duo attacked him with the knife. When he fell bleeding, they took his phone and fled. The phone was sold for Rs 1,500 to Arpit with which the duo bought drugs. Harish claimed it was the juvenile’s plan to rob the victim. Efforts are on to nab the rest of the gang members.",-1	-1,0	0,https://www.business-standard.com/article/news-ani/new-delhi-crime-branch-arrests-three-men-for-plotting-murder-119101400063_1.html	https://timesofindia.indiatimes.com/city/delhi/arrest-of-snatchers-solves-rohini-murder-case/articleshow/72031258.cms,89
Madanpur Khadar,2019-10-15	2019-10-15	2020-02-04,Times of India	Business Standard	Business Standard,"8 cases of theft, robbery cracked with arrest of 2 people: Delhi police | Delhi News - Times of India	8 cases of theft, robbery cracked with arrest of 2 people: Delhi police	Three, including two juveniles, held for killing man for resisting robbery in Delhi",robbery	robbery	robbery,"NEW DELHI: Delhi police on Tuesday claimed to have cracked eight cases of robbery and theft with the arrest of two men, one of them carrying a reward of Rs 50,000, from southeast Delhi. Amber Jafri (28), a resident of Aligarh, and Mohammad Abbas (22), from Amroha , were arrested from Madanpur Khadar, said Deputy Commissioner of Police (Southeast) Chinmoy Biswal A pistol with two live cartridges, one button activated knife, one stolen motorcycle and five mobile phones were seized from them, Biswal said.Jafri and his associates were arrested by UP police in a case of murder in Aligarh, he said.During interrogation, the accused revealed that they started committing robbery and snatching to earn quick money. Jafri had formed his own gang and often recruited new members. He always carried a firearm with him, the DCP said.In January, Jafri and his associates looted Rs 1 lakh from a meat trader in Shaheen Bagh in Delhi. In August, he and Abbas robbed a collection agent of Rs 2.5 lakh in the same area, the officer said.In March, the duo robbed Rs. 1.35 lakh and gold chain from a couple in Zakir Nagar, he said.	Delhi police on Tuesday claimed to have cracked eight cases of robbery and theft with the arrest of two men, one of them carrying a reward of Rs 50,000, from southeast Delhi.

Amber Jafri (28), a resident of Aligarh, and Mohammad Abbas (22), from Amroha, were arrested from Madanpur Khadar, said Deputy Commissioner of Police (Southeast) Chinmoy Biswal.

A pistol with two live cartridges, one button activated knife, one stolen motorcycle and five mobile phones were seized from them, Biswal said.

Jafri and his associates were arrested by UP police in a case of murder in Aligarh, he said.

During interrogation, the accused revealed that they started committing robbery and snatching to earn quick money. Jafri had formed his own gang and often recruited new members. He always carried a firearm with him, the DCP said.

In January, Jafri and his associates looted Rs 1 lakh from a meat trader in Shaheen Bagh in Delhi. In August, he and Abbas robbed a collection agent of Rs 2.5 lakh in the same area, the officer said.

In March, the duo robbed Rs. 1.35 lakh and gold chain from a couple in Zakir Nagar, he said.	A man was arrested and two of his juvenile accomplices were apprehended for allegedly stabbing another man to death after robbing his mobile phone in south Delhi's Malviya Nagar last week, police said on Tuesday.

The accused was identified as Rohit Kumar, a resident of Delhi's Madanpur Khadar. He works as a daily wage labourer and has a criminal record, they said.

A case was registered on January 31 based on the statement of one Amardeep Kumar. He alleged that three persons robbed him at knifepoint. When he resisted, the assailants stabbed him in the thigh and snatched his mobile phone, the police said.

Amardeep was seriously injured in the incident and died on the same day, they said.

A raid was conducted at a slum near Hanuman Mandir in Delhi's Madanpur Khadar area and Rohit and his associates were apprehended, Deputy Commissioner of Police (Crime) Bhisham Singh said.

During interrogation, the accused confessed to the crime. The victim's mobile phone has also been recovered, he said.",-1	-1	-1,0	0	0,https://timesofindia.indiatimes.com/city/delhi/8-cases-of-theft-robbery-cracked-with-arrest-of-2-people-delhi-police/articleshow/71602738.cms	https://www.business-standard.com/article/pti-stories/8-cases-of-theft-robbery-cracked-with-arrest-of-2-people-delhi-police-119101501401_1.html	https://www.business-standard.com/article/pti-stories/three-including-two-juveniles-held-for-killing-man-for-resisting-robbery-in-delhi-120020500027_1.html,83
Connaught Place,2019-10-15,Hindustan Times,"Murder in Delhi’s CP over entry to shelter home, two homeless men held",murder,"Two homeless men were arrested for allegedly murdering a 26-year-old sanitation worker of a night shelter near Bangla Sahib Gurdwara in central Delhi, over not letting them enter the facility because of their “illegal” activities, police said on Tuesday. Police said the arrested men, Kunal alias Anshul,22, and Prem Kumar,22, allegedly stabbed to death Praveen (single name) near Rajiv Gandhi Handicrafts Bhawan in Connaught Place on Saturday morning. The two were involved in several cases of pick pocketing in moving trains, which emerged after police recovered 14 stolen cellphones and two laptops from a room where they had hidden the blood-stained clothes they were wearing during the murder, the police said. Praveen was walking with his friend Razi Mohammad on the pavement when they were cornered by the two homeless men. One of them overpowered Mohammad while the other stabbed Praveen and hit his head with a brick before fleeing, the police said. Deputy commissioner of police (New Delhi) Eish Singhal said the injured man was admitted at a nearby government hospital in a critical condition. A case of attempt to murder was registered on Mohammad’s complaint. Praveen succumbed to the stab injury during treatment after which police added section 302 (murder) of Indian Penal Code. During the probe, the DCP said, the caretaker of the night shelter, Manjeet Singh, told the police that the suspects had been banned for entering the home because they were involved in illegal activities. “Praveen had evicted the duo out of the shelter home on two-three occasions and that had led the two develop animosity against him,” said the DCP.",26,0,https://www.hindustantimes.com/cities/murder-in-cp-over-entry-to-shelter-home-two-homeless-men-held/story-5qpr4dGWHBqMn6L9pA7KZL.html,95
Jasola,2019-10-17	2019-10-17,Business Standard	Times of India,"27 years on, cops solve murder case only to find accused dead	Thane: 27 years on, cops solve murder case only to find accused dead | Thane News - Times of India",murder	murder,"Thane police in Maharashtra have cracked a 27-year-old case of killing of a sub-inspector, only to find that the accused died seven years ago, an official said on Thursday.

On July 23, 1992, sub-inspector Mahendra Singh Patil, then attached to Mahatma Fule Chowk police station in Kalyan town, was stabbed to death by the accused, Iqbal alias Nanhe Khan, during a confrontation, crime branch's senior inspector Nitin Thakre said.

After the killing, the accused, who was also wanted in connection with several robberies in the area, absconded and eluded the police for nearly three decades, he said.

During a recent review of the unsolved cases, the crime branch of Thane police got information that Khan's whereabouts were last traced to Jasola village in Okhla area of Delhi.

Last week, a Thane police team went to Okhla to nab Khan, but got to know that he died of an ailment seven years ago, Thakre added.	THANE: Thane police in Maharashtra have cracked a 27-year-old case of killing of a sub-inspector , only to find that the accused died seven years ago, an official said on Thursday.On July 23, 1992, sub-inspector Mahendra Singh Patil , then attached to Mahatma Fule Chowk police station in Kalyan town, was stabbed to death by the accused, Iqbal alias Nanhe Khan, during a confrontation, crime branch's senior inspector Nitin Thakre said.After the killing, the accused, who was also wanted in connection with several robberies in the area, absconded and eluded the police for nearly three decades, he said.During a recent review of the unsolved cases, the crime branch of Thane police got information that Khan's whereabouts were last traced to Jasola village in Okhla area of Delhi.Last week, a Thane police team went to Okhla to nab Khan, but got to know that he died of an ailment seven years ago, Thakre added.",27	27,0	0,https://www.business-standard.com/article/pti-stories/27-years-on-cops-solve-murder-case-only-to-find-accused-dead-119101700703_1.html	https://timesofindia.indiatimes.com/city/thane/thane-27-years-on-cops-solve-murder-case-only-to-find-accused-dead/articleshow/71630828.cms,89
Gautam Nagar,2019-10-17,Times of India,Safdarjung doctor arrested for rape and blackmail | Delhi News - Times of India,rape,"NEW DELHI: A doctor with the Safdurjung Hospital has been arrested after he allegedly raped a 27-year-old woman repeatedly after blackmailing her with photographs of her that he had clicked. The woman had approached the cops after which a case was registered. The doctor’s phone was seized after which he was arrested.In her complaint, the woman told the cops that she used to work as a medical representative with a well-known pharma company and met the doctor at the hospital. After a few visits, she became friends with the doctor, who had called her for a coffee at a cafe in Green Park. She had even introduced her husband to the doctor and his family members later.After a few days, the doctor advised her to appear for a government examination and offered to coach her. He asked her to come to a rented house in Gautam Nagar where he taught a few other students.The woman said that on May 10, he called her to his room when no one else was present and offered her a drink laced with sedatives. The woman said she felt dizzy and the doctor raped her and took obscene pictures of her. When she gained her senses, he showed her the pictures and threatened to make them go public if she resisted his advances. He raped her several times threatening her with the pictures.The woman revealed her ordeal to a cousin who confronted the doctor. Following this, the accused forwarded the obscene photographs to the woman’s husband, leading to discord in her marriage.Finally, the woman went to the police and a case was registered. Police arrested him on the basis of the evidence provided by the woman.The hospital was not available for comment.",27,0,https://timesofindia.indiatimes.com/city/delhi/safdarjung-doctor-arrested-for-rape-and-blackmail/articleshow/71622202.cms,95
Green Park,2019-10-17,Times of India,Safdarjung doctor arrested for rape and blackmail | Delhi News - Times of India,rape,"NEW DELHI: A doctor with the Safdurjung Hospital has been arrested after he allegedly raped a 27-year-old woman repeatedly after blackmailing her with photographs of her that he had clicked. The woman had approached the cops after which a case was registered. The doctor’s phone was seized after which he was arrested.In her complaint, the woman told the cops that she used to work as a medical representative with a well-known pharma company and met the doctor at the hospital. After a few visits, she became friends with the doctor, who had called her for a coffee at a cafe in Green Park. She had even introduced her husband to the doctor and his family members later.After a few days, the doctor advised her to appear for a government examination and offered to coach her. He asked her to come to a rented house in Gautam Nagar where he taught a few other students.The woman said that on May 10, he called her to his room when no one else was present and offered her a drink laced with sedatives. The woman said she felt dizzy and the doctor raped her and took obscene pictures of her. When she gained her senses, he showed her the pictures and threatened to make them go public if she resisted his advances. He raped her several times threatening her with the pictures.The woman revealed her ordeal to a cousin who confronted the doctor. Following this, the accused forwarded the obscene photographs to the woman’s husband, leading to discord in her marriage.Finally, the woman went to the police and a case was registered. Police arrested him on the basis of the evidence provided by the woman.The hospital was not available for comment.",27,0,https://timesofindia.indiatimes.com/city/delhi/safdarjung-doctor-arrested-for-rape-and-blackmail/articleshow/71622202.cms,95
