location,date,source,headline,crime_type,article,age,businessman,url,percentile
Civil Lines,2019-09-05	2019-10-10	2019-10-31	2019-11-01	2019-11-04	2019-12-15	2020-02-03	2020-02-07	2020-02-24	2020-02-28	2020-03-17	2020-04-21,Business Standard	Hindustan Times	Times of India	Times of India	United News of India	Times of India	Times of India	Hindustan (India)	Times of India	Hindustan Times	Times of India	United News of India,"CBI takes over probe in businessman's murder in Allahabad	Grandparents among 7 held for kidnapping, selling 6-week-old baby for Rs 4 lakh in Punjab	UP: Karwariya brothers convicted for SP MLA's murder | Allahabad News - Times of India	Allahabad: Ex-BSP MP, 3 others convicted of murder | Allahabad News - Times of India	SP leader murder case: Karwariya brothers sentenced for life	On the run after robbery, man arrested in Civil Lines | Allahabad News - Times of India	Patiala: Man, father booked for rape, cheating | Ludhiana News - Times of India	16-year-old rape victim gets nod to abort a baby of 24 weeks	Punjab: Military shotgun champion, father booked for hockey players’ double murder | Ludhiana News - Times of India	Rape complainant, 19, attacked with acid by accused’s wife	Delhi: Siblings murder each other over property dispute | Delhi News - Times of India	Murder accused inspector nabbed, sent for 14-days judicial custody",murder	kidnapping	murder	murder	murder	robbery	rape	rape	murder	rape	murder	murder,"The CBI has launched a probe against former BSP MLA Pooja Pal in connection with the killing of businessman Lalit Verma in Allahabad in 2016, officials said on Thursday.

Pooja, wife of BSP MLA Raju Pal who was allegedly killed on the orders of former SP MP Ateeq Ahmad, has been booked along with her brother Rahul and five others -- Dilip Pal, Prithvi Pal, Sandeep Yadav, Rajesh Tripathi and businessman Mukesh Kesarwani, they said.

She had joined the Samajwadi Party (SP) before elections in March this year.

The agency has taken over an FIR registered by the Uttar Pradesh Police as per the procedure.

It is alleged that Lalit Verma, along with his brother Vikram, was going to visit his lawyer in Civil Lines area of Allahabad when the two were shot at by assailants on February 3, 2016. While Lalit died, his brother was seriously injured.

Lalit's father Vinod and younger brother Virendra were on another motorcycle.

According to the FIR, an SUV overtook them and blocked Lalit's motorcycle, following which the assailants allegedly stepped out of the car and shot at Lalit and Vikram.

Lalit's father Vinod claimed that the killing was a result of a land dispute between him and Pooja Pal.

The CBI is already probing the killing of Pooja Pal's husband Raju and filed a charge sheet against Ahmad.	PATIALAPatiala district police arrested seven persons, including five women, on charges of kidnapping and trafficking a baby, on Wednesday. Police said two of the accused were charged under same sections in 2014.The accused sold a 6-week-old baby for Rs 4 lakh, wherein grandparents of the infant are among the accused as they were paid Rs 1 lakh for the deal.Police recovered the baby boy, who was handed over by his grandparents to Saroj Bala, an attendant at Rajindra hospital, on October 2 in exchange for money. The accused have been identified as Sakai Ram, infant’s grandfather, his wife Krishna, Saroj Bala and her contacts—Mamta of Barnala, Kamlesh Rani of Mansa, Seema of Saharanpur, Usha of Amritsar and Pankaj Goyal of Sangrur, to whom the child was sold.SSP Mandeep Singh Sidhu said Rakesh Kumar of Meerapur village complained that his child was kidnapped when his parents, Sakai Ram and Krishna, took him to Rajindra hospital to visit the paediatrician on October 2 in Patiala. The couple also have a three-year-old daughter.In a meticulous investigation, police minutely combed the hospital’s CCTV footage.“On the basis of CCTV cameras footage, we zeroed-in on the child’s grandparents,” he said. SSP said the accused Sakai Ram had deposed that he met Saroj Bala, an attendant at government Rajindra hospital.“Saroj hatched the plan of selling the child and introduced the idea to Sakai Ram. After his consent, Saroj contacted Mamta, Kamlesh, Seema and Usha and asked them to find customers for the baby boy,” the SSP said. Usha informed Saroj about Pankaj Goyal of Sangrur, who wished for a child.“They contacted Pankaj on October 3 and settled the deal at Rs 4 lakh. After Pankaj paid, they gave the child to him,” the SSP said. DSP Yogesh Sharma said Rs 1.94 lakh has been recovered from the accused.He said two of the accused, Usha and Seema, had been charged under same sections in 2014, wherein a case was registered at civil lines police station, but the accused were acquitted in 2016 by local court, he said.“It is a shocking case. The baby’s grandparents were given Rs 1 lakh. The baby is now back with parents,” Sharma said.A case has been registered against all the accused under sections 363A (Kidnapping a minor for purposes of begging), 369 (Kidnapping) and 370 (Trafficking of persons) of IPC.	ALLAHABAD: Former BSP MP Kapil Muni Karwariya, his brothers former BJP MLA Udai Bhan Karwariya and Suraj Bhan Karwariya along with one Ram Chandra aka Kallu have been convicted for the murder of SP leader Jawahar Yadav Additional district and sessions judge Badri Vishal Pandey ended the court proceedings after pronouncing the Karwariya brothers guilty to avoid a ruckus as supporters of the Karwariya brothers were present in large numbers outside the court.Jawahar Yadav was shot dead on August 13, 1996 in the Civil Lines area and his brother Sulaki Yadav had lodged a FIR against the Karwariya brothers.The investigation was handed over to the CB-CID teams from Allahabad, Varanasi and Lucknow.Proceedings in the case were stopped following a high court stay and it was only in 2015 that the hearing began after the stay was vacated.The Karwariya brothers surrendered and went to jail after the Supreme Court ordered that the hearing be completed on priority.The verdict was announced on Thursday though the quantum of sentence is yet to be announced.Jawahar Yadav was a SP MLA from Jhusi assembly segment and his wife, Bijma Yadav, is also a former Samajwadi Party legislator.	ALLAHABAD: Former BSP MP Kapil Muni Karwaria , his brothers Uday Bhan Karwaria and Suraj Bhan Karwaria, and one Ram Chandra Tripathi have been convicted in the sensational murder case of then sitting SP MLA Jawahar Yadav by the Allahabad sessions court on Thursday. Uday Bhan is a former BJP MLA while his wife, Neelam Karwaria, is the sitting BJP MLA from Meja assembly segment of Allahabad.All the four have been convicted under section 302 (committing murder) and section 307 (attempt to commit murder), section 149 (unlawful assembly) and other sections of Indian Penal Code While convicting them for murder, additional sessions judge (ASJ), Allahabad, Badri Vishal Pandey said the quantum of punishment to be awarded to them would be announced in the next hearing on November 4. Earlier, ASJ had reserved the judgment on October 18, 2019 after concluding trial in the case, which lasted for nearly two decades.According to district government counsel (criminal), Gulab Chandra Agrahri, who represented the prosecution side in the matter, as many as 18 witnesses were produced to prove the charges levelled against the accused.The defense counsel also produced as many as 156 witnesses to prove innocence of Karwaria brothers.During trial, testimonies of all witnesses were recorded and they were cross-examined. The trial continued for around 23 years.SP MLA Jawahar Yadav was killed on August 13, 1996, in Civil Lines area of Allahabad. The incident rocked the state, as AK-47 assault rifle was used for the first time in the city. Besides Jawahar, his driver Gulab Yadav and one Kamal Kumar Dixit, a passerby, also died in the firing.An FIR was lodged at Civil Lines police station at the instance of Sulaki Yadav, brother of Jawahar Yadav, on the same day. As per the FIR, Jawahar Yadav had enmity with Kapil Muni and his family members.In the 224-page judgment, additional sessions judge observed the prosecution has been successful in proving its case, hence all the four accused are convicted in Jawahar Yadav murder case.	Prayagraj, Nov. 4 -- A local court on Monday sentenced former Bahujan Samajwadi Party MP Kapil Muni, his two brothers and another person to life imprisonment, in the 23-year-old murder case of SP leader Jawahar Yadav.

The other convicts include Kapil's brothers -- Udai Bhan Karwariya and Suraj Bhan Karwariya -- both former MLAs and Ram Chandra alias Kallu. The convicts were sent to Naini jail after the verdict.

 Additional district and sessions judge Badri Vishal Pandey pronounced the quantum of punishment after the court held the Kanwariya brothers guilty on October 31.

Several supporters tried to create ruckus during the pronouncement of judgement but were pacified by the accused.

The case dates back to 23 years, when on August 13, 1996, SP leader Jawahar Yadav was shot dead in the civil lines area. Then the victim's brother Sulaki Yadav had lodged a complaint against the Karwariya brothers.

The investigation was handed over to the CB-CID teams from Allahabad, Varanasi and Lucknow.


Proceedings in the case were stopped following a high court stay and it was only in 2015 that the hearing began after the stay was vacated.


The Karwariya brothers surrendered and went to jail after the Supreme Court ordered that the hearing be completed on priority.


The victim, Yadav, was an SP MLA from Jhunsi assembly segment of Allahabad and his wife, Bijma Yadav, is also a former Samajwadi Party legislator.
Currently, Neelam Karwaria, wife of the accused Uday Bhan Karwaria is the present BJP MLA from Prayagraj.
UNI MB JAL 1833 Published by HT Digital Content Services with permission from United News of India. For any query with respect to this article or any other content requirement, please contact Editor at contentservices@htlive.com	Allahabad: Special Task Force (STF) and Civil Lines police on Saturday arrested the prime accused of an assault-and-robbery case reported in Thane city of Maharashtra on September 16 this year.According to circle officer (CO) STF Navendu Kumar, the arrested person was identified as Vinod Kumar Patel aka Sheru, resident of Chitwar village under Mariyahu police station of Jaunpur.“Acting on a tip-off on Saturday, STF arrested Vinod Kumar Patel from Civil Lines bus depot when he was about to flee to another city. During interrogation, he confessed of robbing passengers, along with his accomplice Pawan Patel, an auto driver, and others,” said the CO.Sheru is accused of strategizing the dacoity that took place under Kasarvadawali police station of Thane on the night of September 16 this year.One Pangmayung Raikhan of Manipur, who worked as a manager at Preetam Global Hotel of Thane, took an auto to his home.The auto driver and three others already seated in the auto, stopped the vehicle at a deserted spot on Ghodbunder Road, stabbed him in the back, robbed him and threw him out of the running auto.Later, Kasarvadavali police registered an FIR against the four men. The investigating team of Thane police retrieved the CCTV footage of the stretch which the assaulters took before and after the crime, and managed to identify one of them.Sandeep Kumar Dubey aka Deepak was then arrested. Deepak named Sheru as the mastermind and his cohort Pawan Patel, both natives of Jaunpur.	(The victim's identity has not been revealed to protect her privacy as per Supreme court directives on cases related to sexual assault).

PATIALA: The police here have booked two persons, including a man and his father, on rape and cheating charges following the complaint made by a woman. The rape survivor said in her complaint that one of the accused had raped her on the pretext of marriage.The police said the medical examination of the rape survivor was conducted, but the reports were awaited. They said the investigation in the matter is still underway, though the case was registered immediately on the complaint of the woman, who runs a restaurant.The case was registered with Civil Lines police here under various sections of IPC including rape, criminal breach of trust, cheating, etc. The police have identified the accused rapist as Sahib Singh of Patiala.""The rape survivor said she used to run a restaurant in the city's posh area where the accused were running their own restaurant just adjacent to hers. She said the accused raped her in October last year and since then was exploiting her physically on the pretext of marriage. The rape survivor also claimed that the accused had planned only to get her restaurant closed as she was their competitor. She also claimed that the accused withdrew all her money in three months and then refused to marry her,"" said civil lines SHO.The survivor said when she had gone to the house of accused she was rebuked and thrashed by the accused and his father.""We have registered the case and initiated the probe. The accused are yet to be nabbed as they are on the run,"" said the police officer.	New Delhi, Feb. 7 -- The High Court on Thursday allowed the 16-year-old rape victim to undergo a 24-week foetal abortion. The court has given this order considering the report of the Medical Board of Ram Manohar Lohia Hospital. The report says that if the victim does not abort the baby, her life may be in danger. Justice Vibhu Bakhru held a closed-door conversation with the victim and her parents. The court ordered the RML hospital doctor to complete the medical procedure of the abortion within 24 hours.

DNA preservation order: The medical board said that the victim and her parents have been informed about the risk of miscarriage and will execute it within hours of the order. The court ordered the abortion of the victim as well as preserving the DNA of the foetus so that it can be used as evidence. The Civil Lines Police has arrested a neighbour accused in the case of raping a teenager. When the victim gave birth to the child in the hospital, the police came to know about the incident.

The 15-year-old victim lives in the Majnu Ka Tila area with her paternal aunts since her parents' death. The 36-year-old Suresh, who lives in the neighbourhood, raped the victim a year ago and threatened to kill her if she told anyone. Meanwhile, the victim became pregnant. When her health deteriorated, the family took her to the hospital. She was found pregnant in the hospital examination. While being admitted, she gave birth to a child. After getting information from the hospital, the Civil Lines Police arrested the accused from Majnu Ka Tila area. Published by HT Digital Content Services with permission from Hindustan. For any query with respect to this article or any other content requirement, please contact Editor at contentservices@htlive.com	PATIALA: Five days after a national-level hockey player and his friend, both employed with the Punjab State Power Corporation Limited (PSPCL), were shot dead by unidentified persons following an argument over a trivial issue at a local Dabha in Partap Nagar area of Patiala, the Patiala police have identified the accused persons and sent out teams to nab them.The accused has been identified as 20-year-old Manraj Singh Sarao , a military shotgun champion and his father Amandeep Singh, who had opened fire at Amrik Singh and Simranjit Singh on Wednesday night.The deceased Amrik Singh son Gurjant Singh resident Majithia Enclave and Simranjit Singh Happy son of Darshan Singh resident Pratap Nagar, who were both working with the PSPCL were shot at from close range with a double-barrel gun at around 11 pm on Wednesday night. Amrik Singh was a national level player, who also played from the power corporation along with Simranjit Singh.On Monday, Patiala senior superintendent of police MS Sidhu said the police investigators, who were initially groped in the dark while looking into the double murder case, picked up electronic and other evidence and finally managed to identify the two accused as Manraj Singh and his father Amandeep Singh.Manraj had recently won a gold and a bronze medal at the Military Shotgun Championship . He was undergoing training at Patiala and was staying with his father Amandeep at a PG accommodation near Partap Nagar, where the murders took place.He said Amandeep Singh, aged 45, who originally hails from Duggal village in Patran block of Patiala district was now living in Sector 66 Mohali. Manraj Singh, a known trapshooting champion owned a licensed 12 bore gun, which is now being believed was used to kill the two hockey players. The cop also learnt that Amandeep was having a marital dispute with his wife and they were living separately, while Manraj used to live with his father.The SSP said after identifying the accused special police teams carried out raids at Mohali, Sangrur, Mansa to nab the accused as it was being suspected that they could be hiding at any of these places.Initially, a case under Section 302 of the IPC and Sections 25/27/54/59 of the Arms Act was registered at the Civil Lines police station and unidentified persons and now the names of the father-son duo have been incorporated in the case, the SSP said.	A 19-year-old woman received burn injuries on her hand and leg after three people, including a woman, attacked her with acid near the senior superintendent of police’s residence in Meerut’s Civil Lines area on Wednesday night, the Uttar Pradesh police said on Thursday.In her complaint, the 19-year-old alleged the attackers included two men and a sub-inspector’s wife, Neetu, who had earlier lodged a fake complaint against her. She said the case was lodged against her and her brother after she filed a rape complaint against the sub-inspector, Narendra, in 2018.“The girl residing in Pallavpuram filed a complaint alleging that a woman, who had earlier filed a complaint against her, was among the attackers,” said Sanjeev Deshwal, circle officer, Civil Lines police station.“In 2018, the girl filed a complaint of rape against the sub-inspector. Later, the sub-inspector’s wife filed a complaint against the girl and she was also sent to jail. At present she is out on bail,” added Deshwal.Police said the sub-inspector is posted at Behsuma police station. “A probe has begun and things would become clear thereafter,” said Deshwal.	NEW DELHI: Two siblings were killed at their home in north Delhi’s Civil Lines on Sunday night after they opened fire at each other while fighting over a property. The deceased, Rahul Nagar (34) and Tanuj Nagar (27), stayed in Bhargav Lane area.Rahul worked as a clerk at the Saket court, while Tanuj is unemployed. They were allegedly having a dispute over their ancestral property in Greater Noida.According to a family member, the siblings were arguing for a long time in Rahul’s living room. It suddenly turned into a scuffle during which Tanuj allegedly pulled out a weapon and shot Rahul in his chest. Despite his injuries, Rahul tried to disarm Tanuj during which the weapon went off and hit Tanuj in his abdomen.In a CCTV footage, Rahul is seen stepping out of the house with blood on his chest. He tries to walk but collapses on the road. Tanuj is then seen stepping out of the house and firing one more round at his brother and fleeing. Family members said that after running a few metres, he collapsed.Hearing the gunshots, the neighbours too had gathered. But the siblings were taken to the hospital only when the PCR arrived, claimed the family. The brothers were declared dead on arrival.A police probe revealed that Rahul and Tanuj were earlier staying with their parents at the DDA flat. Rahul had married three years ago and shifted to another house in the same area with his family, while Tanuj stayed with the parents.Their father earlier used to work as a clerical staffer at Tis Hazari court. He had retired a few years back and then taken the DDA flat on rent. He has two other sons, who work as transporters.On Sunday, when Rahul returned from a party, he found Tanuj sitting in the living room and drinking. An argument started over this and later the property matter was brought up. During this, Rahul allegedly attacked Tanuj leading to the scuffle.In Video: On cam: Siblings murder each other over property dispute in Delhi	Kaithal, April 21 -- A police team led by Inspector Parhlad Rai SHO civil lines here on Tuesday arrested Inspector Satbir (57), wanted in a murder and attempt to murder case. 

He was arrested from his official residence in police colony adjoining women police station on Karnal road here.

His service revolver with whom he had allegedly killed his son and injured three other family members with five live cartridges was also seized by police . 

The police also recovered five empty cartridges from the spot .

UNI XC JAL 2239 Published by HT Digital Content Services with permission from United News of India. For any query with respect to this article or any other content requirement, please contact Editor at contentservices@htlive.com",-1	3	-1	-1	23	-1	-1	16	20	19	-1	-1,1	0	0	0	0	0	0	0	0	0	0	0,https://www.business-standard.com/article/pti-stories/cbi-takes-over-probe-in-businessman-s-murder-in-allahabad-119090501529_1.html	https://www.hindustantimes.com/cities/patiala-police-recover-6-week-old-baby-sold-for-rs4-lakh-grandparents-got-25-in-deal/story-WelJIbzGhA2utXb8kFV8VP.html	https://timesofindia.indiatimes.com/city/allahabad/karwariya-brothers-convicted-for-sp-mlas-murder/articleshow/71838960.cms	https://timesofindia.indiatimes.com/city/allahabad/allahabad-ex-bsp-mp-3-others-convicted-of-murder/articleshow/71845422.cms	na	https://timesofindia.indiatimes.com/city/allahabad/on-the-run-after-robbery-man-arrested-in-civil-lines/articleshow/72624938.cms	https://timesofindia.indiatimes.com/city/ludhiana/patiala-man-father-booked-for-rape-cheating/articleshow/73895014.cms	na	https://timesofindia.indiatimes.com/city/ludhiana/military-shotgun-champion-father-booked-for-hockey-players-double-murder/articleshow/74287612.cms	https://www.hindustantimes.com/india-news/rape-complainant-attacked-with-acid-by-accused-s-wife/story-ZoqER4xbcUHJHX9vcpuoCP.html	https://timesofindia.indiatimes.com/city/delhi/siblings-murder-each-other-over-property-dispute/articleshow/74663970.cms	na,30
