location,date,source,headline,crime_type,article,age,businessman,url,percentile
Prem Nagar,2019-08-04	2019-10-01	2019-10-23	2019-11-29	2019-12-12,India Blooms	Hindustan Times	Hindustan Times	Times of India	Times of India,"Case registered against man for posting derogatory comment on rape-accussed BJP MLA Sengar's daughter	Two murders in less than 12 hours in Delhi	Kamlesh Tiwari murder: Cleric, two others detained hours before arrest of alleged killers	Hyderabad: Five arrested for pastor’s murder | Hyderabad News - Times of India	Loni murder: Woman’s nephew killed her | Noida News - Times of India",rape	murder	murder	murder	murder,"Unnao, Aug. 4 -- Local police have registered a case against a man for making derogatory comments on rape-accused BJP MLA Kuldeep Singh Sengar's daughter on social media.

City Kotwali In-charge Dinesh Chandra Mishra said here on Sunday that Anil Kumar Sunil, resident of Prem Nagar colony in Gangaghat area, had posted derogatory comment against Sengar's daughter on a social media platform.

Police have registered complaint against Sunil under the IT Act, on the complaint of Dhananjay Singh, resident of PD Nagar area and launched a manhunt to nab him. Meanwhile, the accused has deleted the post and apologised for his former comment. Published by HT Digital Content Services with permission from India Blooms. For any query with respect to this article or any other content requirement, please contact Editor at contentservices@htlive.com	A 22-year-old alleged bootlegger was shot dead in front of his brother by man and his two associates in outer Delhi’s Prem Nagar on Monday night, the police said. The victim had allegedly slapped and humiliated the man in public for demanding free liquor. The suspects were arrested on Tuesday evening and were booked for murder at the Prem Nagar police station. They were identified as Manish alias Monu,23, Neeraj,22, and Niraj,20. Manish, the prime suspect, took revenge on Ashish Kumar allegedly slapping and humiliating him a fortnight ago, police said. Kumar was living in a rented house with his live-in partner in Prem Nagar Part-2 for the last three years. He was disowned by his family for running an illegal liquor business, the police said.Deputy commissioner of police (Rohini) SD Mishra said that police on Monday night received information that a man was shot by some men. A police team found Kumar with a gunshot injury below his chest. He was rushed to a nearby hospital where he was declared brought dead. “Kumar’s brother, Shivam, was an eyewitness to the crime and identified the suspects. Raids were conducted and the three suspects were caught from different places in outer Delhi,” said a police officer, associated with the case.Manish told police that around a fortnight ago, Kumar had slapped him when he asked for a bottle of liquor for free. “Manish decided to kill him. He convinced his two friends for assistance and they executed the murder plan on Monday night,” the officer added.In another incident, two bike-borne men allegedly shot a 27-year old contractual labourer in his face in east Delhi’s Kalyanpuri on Tuesday morning. Police suspect monetary dispute behind the murder. Locals told police that the duo shot him as he stopped them from creating a ruckus in the neighbourhood and objected to their abuses. One of the alleged attackers, Guddu, was caught by the public, who thrashed him and set his bike on fire before handing him over to the police. The man who was killed was identified as Jaspal. Police said they received a call around 5am reporting that a man has been shot dead. Jaspal, who works as a labourer at construction sites, was rushed to hospital where he succumbed to his injuries. Locals told police that they saw the two men brandishing gun while making their way through the narrow lanes. Jaspal raised objections and tried to stop the bikers. As he tried to overpower them, one of the two shot him in his face. As they tried to flee, locals caught Guddu and set the bike on fire. Deputy commissioner of police (east) Jasmeet Singh said Guddu was arrested.	Hours before the Gujarat ATS arrested the two alleged killers of Hindu Samaj Party leader Kamlesh Tiwari, the UP police, working in tandem with security agencies of other states, had tightened the noose around those in their network, said senior state police authorities.A senior police officer said three persons, including a Bareilly resident Maulana Kaifi Ali, had been taken into custody by the state police. They were being brought to Lucknow for further quizzing, said an officer.One person, who was in touch with the three alleged conspirators arrested from Surat in Gujarat on October 19, was also being quizzed by the Karnataka police in Bengaluru, he added.He said Maulana Kaifi Ali was picked from his house in Bareilly’s Prem Nagar locality and being brought here for questioning. He claimed the two alleged killers, Sheikh Ashfaq Hussain and Pathan Moinuddin Ahmed, both residents of Surat, visited Ali’s place in Bareilly after executing Tiwari’s killing in Lucknow on October 18.Ali allegedly helped one of two alleged killers, Pathan Moinudeen Ahmed, in the treatment of his injuries caused in his right hand while attacking Tiwari with a knife.He said Ahmed was treated at a private hospital in Bareilly on the night of October 18, after which they again returned to Lakhimpur Kheri with a plan to sneak into Nepal from Gauri Fanta area on India-Nepal border. The official said two others, driver Tauhid Ahmed and owner Rajkumar of a car hired by two killers from Palia area of Lakhimpur Kheri had been detained for questioning.The officer said the two alleged killers visited Gauri Fanta but the border was closed and intensified checking was going on following which they returned to Shahjahanpur on the same cas. He said the two killers went missing after they left the car near Shahjahanpur railway station on October 20 midnight.Multiple teams of Lucknow police, UP Special Task Force and Anti-Terror Squad were camping in Shahjahanpur and Lakhimpur Kheri after the two alleged killers’ movement were tracked in the region, he added. He said the killers’ last movement was captured in a CCTV camera of a hotel near Shahjahanpur railway station at around 12.02 am on Sunday/Monday night.Tiwari was murdered on October 18 by the two killers by entering his house cum office at Lucknow’s Khurshed Bagh locality on pretext of joining his organisation’s Gujarat unit. The killers were wearing saffron colour Kurtas to pose themselves as Hindu activist. The killing of Tiwari has triggered panic and the state police with help of the Gujarat ATS arrested the three alleged conspirators Faizan Yunus, 21, Maulana Mohsin Sheikh, 24, and Rashid Ahmad alias Rashid Pathan, 23, on the intervening night of October 18 and 19.The arrest of the three men came after boxes of sweets from a shop in Surat were discovered at the crime scene in Lucknow. The two killers were seen carrying the box on CCTV footage captured outside Tiwari’s house. The official said the sweet box, which was used to carry weapons, including a country-made gun and knives, was bought from a shop Dharti Farsan in Surat.Will ensure strict punishment for guilty: MauryaDeputy chief minister Keshav Prasad Maurya congratulated Gujarat’s ATS. “I congratulate Gujarat ATS for arresting the main accused in the murder case. We will try and ensure strictest possible punishment for them,” Maurya tweeted soon after the Gujarat ATS went public with the arrests.Before the arrests, the Sashastra Seema Bal (SSB), which guards India-Nepal border, had intensified the deployment of its personnel across the entire border stretching from UP to Bihar apprehending that the two killers may sneak into Nepal.A senior police official privy to development said the extra SSB personnel were called from its Lucknow headquarters for deployment in districts on India Nepal border. In addition, the state police authorities had alerted the local police in all seven districts touching India-Nepal border, he added.UP shares a 599.3 km long open border with Nepal touching seven districts – Pilibhit, Lakhimpur Kheri, Bahraich, Sravasti, Balrampur, Sidhharthnagar and Maharajganj.Aide brought to LucknowSayyed Asim Ali, one the alleged associates of Kamlesh Tiwari’s killers arrested from Nagpur, was brought to Lucknow on Tuesday by UP police after procuring his transit remand. A Lucknow police official said the Nagpur court granted Asim Ali’s 72 hours transit remand, so he will be presented before the competent court here on Wednesday.	HYDERABAD: Police arrested a real estate broker and four of his associates in connection with the murder of 48-year-old pastor A Satyanarayana Reddy at Kondapur. Police said that personal enmity was the reason behind the murder.The accused are, Md Zameel alias Nawab, 46, a real estate broker from Prem Nagar in New Hafeezpet, his associates, Sk Shabbir, 44, fruit vendor from Gajularamaram in Jeedimetla , Mohammed Azhar, 27, of tape edge machine operator from Hafeezpet, Mohammed Ismail, 23, a plumber from Hafeezpet and M Ravi, 19, a student from Hafeezpet.According to Madhapur DCP A Venkateswara Rao, the main accused Zameel got acquainted with Satyanarayana Reddy about two years ago as part of real estate business. “Reddy was the pastor of Rehoboth Church in Anantapur and he also used to dabble in real estate business at Hafeezpet, where he had some plots and shops. About seven months ago, Reddy took Rs 3 lakh from Zameel by promising to secure him some land deals,” the DCP said.However, Zameel later found out that, Reddy, got those deals finalised to other clients and made a handsome amount as commission. “When Zameel demanded Reddy to return his Rs 3 lakh, the latter refused to do so. Enraged, Zameel along with some of his associates trespassed into Reddy’s plot in Hafeezpet and wrote his name as the owner on the compound wall. Reddy then lodged a complaint against Zameel at Miyapur PS,” Gachibowli inspector R Srinivas said.Zameel then decided to eliminate Reddy and hatched a plan with other accused by offering money. Ravi called Reddy to Hyderabad. After Reddy reached Hafeezpet on November 22 to meet Ravi, the latter did not answer his phone calls. “After waiting for a while, Reddy started on a bike towards Kondapur. Ravi along with Azhar and Ismail, kept a watch on him and informed Zameel and Shabbir, who intercepted Reddy and stabbed him, the DCP said.	Ghaziabad: Four persons were arrested on Tuesday night for allegedly shooting dead a 45-year-old woman from point-blank range in Loni area on December 5.The woman’s nephew and his three friends had murdered her over a property dispute, said police. The deceased Indra Verma’s nephew had allegedly built a house on a plot of land that belonged to her and when she asked him to vacate it, he hatched a plan to kill her.Indra Verma, a resident of Delhi’s Ganga Vihar, was the sister of the main accused Arvind Kumar Verma’s mother. Police said apart from Arvind, who worked as a freelance make-up artist with several news channels, his friends Rohit Kumar Vajpayee, Harish Kumar Khatik and Prince were also nabbed.All the four are residents of Loni.Indra was shot at in Prem Nagar at 1.20pm on December 5.SP (rural) Neeraj Kumar Jadaun said, “It was Harish who had shot at Indra while Rohit was riding the bike. During investigation, Arvind told police that her aunt had a 356 sq foot plot in Loni’s Gulab Vatika and on this plot he had built a house with his capital. He also had the power of attorney of the property, but Indra was pressurising him to vacate it so that she could sell it.”Arvind said he was infuriated with Indra’s behaviour and planned to kill her.Harish was also nursing a grudge against the deceased as she had taken Rs 30,000 from him on the assurance of providing him with a job, but apparently she did not fulfil her promise.“Arvind was aware of Indra’s visit to Seema’s house and he had made a WhatsApp call to Harish to tell about her location. During questioning, none of the accused showed any remorse. Investigation revealed that Arvind had promised Rs 5 lakh to Harish and Rohit each in return for the murder . Harish, in turn, had asked Prince to arrange the bike,” the SP added.Jadaun further said, “After the incident, police had investigated the call details of Indra and got the number of another property dealer. The property dealer told police that Indra wanted to sell Arvind’s house and asked him to get the house vacated. The property dealer had also told the police about the ongoing conflict between Arvind and Indra.”",-1	22	-1	48	45,0	0	0	0	1,na	https://www.hindustantimes.com/cities/two-murders-in-less-than-12-hours-in-delhi/story-02vFc62T34JaV3S8BycwpJ.html	https://www.hindustantimes.com/cities/tiwari-murder-cleric-two-others-detained-hours-before-arrest-of-killers/story-uoXpKP2JkV6lTlaUolwk0O.html	https://timesofindia.indiatimes.com/city/hyderabad/five-arrested-for-pastors-murder/articleshow/72284928.cms	https://timesofindia.indiatimes.com/city/noida/loni-murder-womans-nephew-killed-her/articleshow/72482111.cms,71
